{
  "schemaVersion": 1,
  "skill": "base-code-review",
  "status": "completed",
  "mode": "autonomous",
  "summary": "Bounded same-session local review found no remaining objective findings in the controller-initialization repair after its queue-mutation guard was added.",
  "artifacts": [
    { "kind": "file", "operation": "read", "subject": "scripts/sdd/autonomous-sdd-controller.mjs" },
    { "kind": "file", "operation": "read", "subject": "scripts/runtime/bin/autonomous-sdd-controller.mjs" },
    { "kind": "file", "operation": "read", "subject": "scripts/runtime/manifest.json" },
    { "kind": "file", "operation": "read", "subject": "skills/base/autonomous-sdd-delivery/SKILL.md" },
    { "kind": "file", "operation": "read", "subject": "skills/base/autonomous-sdd-lifecycle/SKILL.md" }
  ],
  "evidence": [
    { "id": "focused-suite", "type": "test", "subject": "initializer success, recovery, conflict, runtime, and adapter cases", "result": "passed", "reference": "13 focused Node tests at the reviewed working-tree implementation" },
    { "id": "full-sdd-suite", "type": "test", "subject": "SDD Node test suite", "result": "passed", "reference": "198 local Node tests" },
    { "id": "runtime-suite", "type": "test", "subject": "runtime Node test suite", "result": "passed", "reference": "66 local Node tests" },
    { "id": "openspec-strict", "type": "validation", "subject": "all OpenSpec specifications and active changes", "result": "passed", "reference": "39 strict validation items" },
    { "id": "review-source", "type": "review", "subject": "controller state transitions, runtime dispatch, canonical guidance, documentation, and tests", "result": "passed", "reference": "same-session read-only review after the queue guard correction" }
  ],
  "assumptions": [],
  "openQuestions": [],
  "nextAction": { "kind": "continue", "description": "Proceed to formal OpenSpec Verify, then use only the exact bootstrap bridge for this repair's implementation, Sync, Archive, and cleanup lifecycle." },
  "details": {
    "assurance": "local-review",
    "worker": { "executionIdentity": "same-session-local-review-worker", "sameSession": true, "readOnly": true, "canMutate": false, "canApprove": false },
    "reviewedScope": {
      "targets": ["scripts/sdd/autonomous-sdd-controller.mjs", "scripts/runtime/bin/autonomous-sdd-controller.mjs", "scripts/runtime/manifest.json", "scripts/sdd/test/autonomous-sdd-admission.test.mjs", "skills/base/autonomous-sdd-delivery/SKILL.md", "skills/base/autonomous-sdd-lifecycle/SKILL.md", "docs/autonomous-sdd-lifecycle.md", "docs/sdd-workflow.md", "docs/sdd-foundation-operations.md"],
      "contextPaths": ["openspec/changes/repair-v2-controller-initialization/proposal.md", "openspec/changes/repair-v2-controller-initialization/design.md", "openspec/changes/repair-v2-controller-initialization/tasks.md", "openspec/changes/repair-v2-controller-initialization/specs/autonomous-sdd-continuation/spec.md", "openspec/changes/repair-v2-controller-initialization/specs/autonomous-sdd-run-contract/spec.md", "openspec/changes/repair-v2-controller-initialization/specs/shared-sdd-runtime-distribution/spec.md"],
      "evidenceIds": ["focused-suite", "full-sdd-suite", "runtime-suite", "openspec-strict", "review-source"]
    },
    "findings": [],
    "coverage": [
      { "area": "initializer identity and lifecycle eligibility", "status": "reviewed", "evidenceIds": ["review-source", "focused-suite"] },
      { "area": "failure recovery and durable-state integrity", "status": "reviewed", "evidenceIds": ["review-source", "focused-suite"] },
      { "area": "runtime exposure, adapter thinness, and regressions", "status": "reviewed", "evidenceIds": ["runtime-suite", "full-sdd-suite"] },
      { "area": "authorization, portability, and sensitive data", "status": "reviewed", "evidenceIds": ["review-source"] },
      { "area": "web accessibility", "status": "not-applicable", "evidenceIds": [] }
    ],
    "standardsSelection": { "selectedRuleIds": [], "scopedOverrides": [], "notApplicableRuleIds": [] },
    "evidenceGaps": [],
    "scopeSummary": "Reviewed only the exact controller-initialization repair. The review verified that a pending schema-5 record cannot select work, advance a phase or queue, bind a resource, or be confused with a different authorization or v2 identity; that the declared runtime dispatches the initializer; and that no reusable asset embeds a real repository credential or user-specific constant."
  }
}
