{
  "schemaVersion": 1,
  "skill": "base-code-review",
  "status": "completed",
  "mode": "autonomous",
  "summary": "Bounded same-session local review found no remaining objective finding in the bootstrap cleanup fresh-inspection repair.",
  "artifacts": [
    { "kind": "file", "operation": "read", "subject": "scripts/sdd/sdd-workspace-cleanup.mjs" },
    { "kind": "file", "operation": "read", "subject": "scripts/sdd/test/sdd-workspace-cleanup.test.mjs" },
    { "kind": "file", "operation": "read", "subject": "scripts/sdd/test/autonomous-sdd-controller.test.mjs" },
    { "kind": "file", "operation": "read", "subject": "ai-planning/handoff-docs/autonomous-sdd-blocker-register-and-plain-english-handoff.md" },
    { "kind": "file", "operation": "read", "subject": "openspec/changes/repair-bootstrap-cleanup-fresh-inspection/" }
  ],
  "evidence": [
    { "id": "focused-suite", "type": "test", "subject": "cleanup helper and bootstrap controller regression tests", "result": "passed", "reference": "33 focused local Node tests at the reviewed workspace" },
    { "id": "full-local-suite", "type": "test", "subject": "repository Node test suite", "result": "passed", "reference": "503 local Node tests at the reviewed workspace" },
    { "id": "openspec-strict", "type": "validation", "subject": "all OpenSpec specs and active changes", "result": "passed", "reference": "39 strict validation items at the reviewed workspace" },
    { "id": "runtime-build", "type": "validation", "subject": "runtime manifest, closure, and smoke build", "result": "passed", "reference": "clean staged runtime build succeeded from the reviewed workspace" },
    { "id": "runtime-reference", "type": "validation", "subject": "runtime helper references", "result": "passed", "reference": "runtime reference validator passed at the reviewed workspace" },
    { "id": "review-source", "type": "review", "subject": "bounded code, tests, handoff, and OpenSpec diff", "result": "passed", "reference": "same-session read-only review after focused and full verification" }
  ],
  "assumptions": [],
  "openQuestions": [],
  "nextAction": { "kind": "continue", "description": "Proceed to formal OpenSpec Verify and the separately authorized delivery lifecycle." },
  "details": {
    "assurance": "local-review",
    "worker": { "executionIdentity": "same-session-local-review-worker", "sameSession": true, "readOnly": true, "canMutate": false, "canApprove": false },
    "reviewedScope": {
      "targets": [
        "scripts/sdd/sdd-workspace-cleanup.mjs",
        "scripts/sdd/test/sdd-workspace-cleanup.test.mjs",
        "scripts/sdd/test/autonomous-sdd-controller.test.mjs",
        "ai-planning/handoff-docs/autonomous-sdd-blocker-register-and-plain-english-handoff.md",
        "openspec/changes/repair-bootstrap-cleanup-fresh-inspection/.openspec.yaml",
        "openspec/changes/repair-bootstrap-cleanup-fresh-inspection/proposal.md",
        "openspec/changes/repair-bootstrap-cleanup-fresh-inspection/design.md",
        "openspec/changes/repair-bootstrap-cleanup-fresh-inspection/tasks.md",
        "openspec/changes/repair-bootstrap-cleanup-fresh-inspection/evidence/local-code-review.json"
      ],
      "contextPaths": [
        "openspec/changes/repair-bootstrap-cleanup-fresh-inspection/proposal.md",
        "openspec/changes/repair-bootstrap-cleanup-fresh-inspection/design.md",
        "openspec/changes/repair-bootstrap-cleanup-fresh-inspection/tasks.md",
        "openspec/specs/sdd-workspace-cleanup/spec.md"
      ],
      "evidenceIds": ["focused-suite", "full-local-suite", "openspec-strict", "runtime-build", "runtime-reference", "review-source"]
    },
    "findings": [],
    "coverage": [
      { "area": "fresh identity comparison and destructive-action guard", "status": "reviewed", "evidenceIds": ["review-source", "focused-suite"] },
      { "area": "bootstrap receipt resume and real mismatch rejection", "status": "reviewed", "evidenceIds": ["focused-suite", "full-local-suite"] },
      { "area": "runtime portability, secrets, authorization, and scope", "status": "reviewed", "evidenceIds": ["review-source", "runtime-build", "runtime-reference"] },
      { "area": "plain-English blocker communication and OpenSpec planning", "status": "reviewed", "evidenceIds": ["review-source", "openspec-strict"] },
      { "area": "web accessibility", "status": "not-applicable", "evidenceIds": [] }
    ],
    "standardsSelection": { "selectedRuleIds": [], "scopedOverrides": [], "notApplicableRuleIds": [] },
    "evidenceGaps": [],
    "scopeSummary": "Reviewed only the fresh-inspection cleanup repair. It omits the transient existence observation symmetrically, still requires fresh presence and every stable resource field to match, records receipts before effects, preserves staged bootstrap cleanup, and documents the permanent repair and safe resume path."
  }
}
