{
  "schemaVersion": 1,
  "skill": "base-code-review",
  "status": "completed",
  "mode": "autonomous",
  "summary": "Fresh bounded local review of the complete frictionless autonomous-prototype diff found no unresolved findings after two fail-closed intake/controller hardening corrections.",
  "artifacts": [
    { "kind": "file", "operation": "read", "subject": "scripts/sdd/issue-intake-binding.mjs" },
    { "kind": "file", "operation": "read", "subject": "scripts/sdd/autonomous-sdd-controller.mjs" },
    { "kind": "file", "operation": "read", "subject": "scripts/sdd/correction-chain.mjs" },
    { "kind": "file", "operation": "read", "subject": "scripts/validation/lib/implementation-quality.mjs" },
    { "kind": "file", "operation": "read", "subject": "skills/base/autonomous-sdd-lifecycle/SKILL.md" }
  ],
  "evidence": [
    { "id": "full-node-suite", "type": "test", "subject": "all repository Node test files", "result": "passed", "reference": "node --test --test-reporter=dot $(rg --files -g '*.test.mjs')" },
    { "id": "focused-hardening", "type": "test", "subject": "issue-intake and controller fail-closed regressions", "result": "passed", "reference": "node --test scripts/sdd/test/issue-intake-binding.test.mjs scripts/sdd/test/autonomous-sdd-controller.test.mjs" },
    { "id": "strict-openspec", "type": "validation", "subject": "all OpenSpec artifacts", "result": "passed", "reference": "openspec validate --all --strict: 31 passed, 0 failed" },
    { "id": "artifact-tracking", "type": "validation", "subject": "change artifacts and tracking metadata", "result": "passed", "reference": "validate-openspec-artifacts.mjs and validate-tracking.mjs" },
    { "id": "adapter-packaging", "type": "validation", "subject": "thin adapters and cross-workspace packaging", "result": "passed", "reference": "check-adapter-drift.mjs and global-skill-installation fixtures" },
    { "id": "reviewed-diff", "type": "review", "subject": "complete branch diff from c39dd04c8f12f2e44b3708f04f1b06056a449c5b", "result": "passed", "reference": "git diff c39dd04c8f12f2e44b3708f04f1b06056a449c5b..HEAD" }
  ],
  "assumptions": [],
  "openQuestions": [],
  "nextAction": { "kind": "continue", "description": "Complete formal Verify and proceed to authorized delivery when host GitHub permission is available." },
  "details": {
    "assurance": "local-review",
    "worker": { "executionIdentity": "same-session-frictionless-prototype-final-review", "sameSession": true, "readOnly": true, "canMutate": false, "canApprove": false },
    "reviewedScope": {
      "targets": [
        "ai-planning/design-briefs/autonomous-prototype-frictionless-quality-loop.md",
        "ai-planning/standards-and-best-practices/sdd-execution-modes-and-gates.md",
        "docs/autonomous-run-enablement.md",
        "docs/autonomous-sdd-lifecycle.md",
        "docs/sdd-foundation-operations.md",
        "docs/sdd-workflow.md",
        "evals/skills/implementation-quality/fixtures/invalid-code-review-misordered.json",
        "evals/skills/implementation-quality/fixtures/valid-code-review.json",
        "evals/skills/implementation-quality/run-fixtures.test.mjs",
        "evals/workflows/autonomous-sdd-lifecycle/fixtures/frictionless-prototype-loop.json",
        "evals/workflows/autonomous-sdd-lifecycle/run-fixtures.test.mjs",
        "evals/workflows/autonomous-sdd-lifecycle/scenarios.json",
        "scripts/github/create-or-find-issue.mjs",
        "scripts/github/lib/issues.mjs",
        "scripts/sdd/autonomous-sdd-controller.mjs",
        "scripts/sdd/check-operation-authorization.mjs",
        "scripts/sdd/correction-chain.mjs",
        "scripts/sdd/issue-intake-binding.mjs",
        "scripts/sdd/resolve-sdd-delivery-request.mjs",
        "scripts/sdd/test/autonomous-sdd-controller.test.mjs",
        "scripts/sdd/test/correction-chain.test.mjs",
        "scripts/sdd/test/issue-intake-binding.test.mjs",
        "scripts/sdd/test/resolve-sdd-delivery-request.test.mjs",
        "scripts/validation/lib/implementation-quality.mjs",
        "skills/base/autonomous-goal-runner/SKILL.md",
        "skills/base/autonomous-goal-runner/references/sdd-delivery-request.md",
        "skills/base/autonomous-sdd-lifecycle/SKILL.md",
        "skills/base/base-code-review/SKILL.md",
        "skills/base/base-code-review/references/evaluation-matrix.md",
        "skills/base/base-code-review/references/review-contract.md",
        "skills/base/base-verification-loop/SKILL.md"
      ],
      "contextPaths": [
        "openspec/changes/autonomous-prototype-frictionless-quality-loop/proposal.md",
        "openspec/changes/autonomous-prototype-frictionless-quality-loop/design.md",
        "openspec/changes/autonomous-prototype-frictionless-quality-loop/tasks.md",
        "openspec/changes/autonomous-prototype-frictionless-quality-loop/specs/autonomous-sdd-continuation/spec.md",
        "openspec/changes/autonomous-prototype-frictionless-quality-loop/specs/base-code-review/spec.md",
        "openspec/changes/autonomous-prototype-frictionless-quality-loop/specs/base-verification-loop/spec.md",
        "openspec/changes/autonomous-prototype-frictionless-quality-loop/specs/bounded-autonomous-execution/spec.md",
        "openspec/changes/autonomous-prototype-frictionless-quality-loop/specs/github-openspec-intake/spec.md",
        "openspec/changes/autonomous-prototype-frictionless-quality-loop/specs/sdd-lifecycle/spec.md",
        "openspec/changes/autonomous-prototype-frictionless-quality-loop/tracking.yaml"
      ],
      "evidenceIds": ["full-node-suite", "focused-hardening", "strict-openspec", "artifact-tracking", "adapter-packaging", "reviewed-diff"]
    },
    "findings": [],
    "coverage": [
      { "area": "requirements, lifecycle behavior, and compatibility", "status": "reviewed", "evidenceIds": ["reviewed-diff", "strict-openspec"] },
      { "area": "tests, evals, negative cases, and recovery", "status": "reviewed", "evidenceIds": ["full-node-suite", "focused-hardening"] },
      { "area": "authorization, intake integrity, secrets, and destructive-action safety", "status": "reviewed", "evidenceIds": ["reviewed-diff", "focused-hardening"] },
      { "area": "portability, attribution, adapters, and packaging", "status": "reviewed", "evidenceIds": ["adapter-packaging", "reviewed-diff"] },
      { "area": "user interface and accessibility", "status": "not-applicable", "evidenceIds": [] }
    ],
    "standardsSelection": { "selectedRuleIds": [], "scopedOverrides": [], "notApplicableRuleIds": [] },
    "evidenceGaps": [],
    "scopeSummary": "Reviewed every non-OpenSpec changed path and all change artifacts against the 15 delta requirements, 53 acceptance scenarios, deterministic test evidence, compatibility constraints, and fail-closed host-permission boundary. Two initial objective findings were corrected and rereviewed; none remain."
  }
}
