{
  "schemaVersion": 1,
  "skill": "base-code-review",
  "status": "completed",
  "mode": "autonomous",
  "summary": "Fresh bounded same-session local review found no unresolved findings after controller run identity, checkpoint path, phase-chain, archive containment, domain-record, digest, and timestamp bindings were verified.",
  "artifacts": [
    { "kind": "file", "operation": "read", "subject": "scripts/sdd/autonomous-sdd-admission.mjs" },
    { "kind": "file", "operation": "read", "subject": "scripts/sdd/autonomous-sdd-legacy.mjs" },
    { "kind": "file", "operation": "read", "subject": "scripts/sdd/test/autonomous-sdd-admission.test.mjs" },
    { "kind": "file", "operation": "read", "subject": "scripts/runtime/test/launcher.test.mjs" },
    { "kind": "file", "operation": "read", "subject": "openspec/changes/repair-v2-initializer-terminal-controller-inventory" }
  ],
  "evidence": [
    { "id": "focused", "type": "test", "subject": "terminal schema-5 admission matrix", "result": "passed", "reference": "40 focused tests" },
    { "id": "installed-wrapper", "type": "test", "subject": "staged runtime with real Git-common and archive state", "result": "passed", "reference": "launcher critical flow" },
    { "id": "full-node", "type": "test", "subject": "repository Node suites", "result": "passed", "reference": "511 tests" },
    { "id": "strict-openspec", "type": "validation", "subject": "all living specifications and active changes", "result": "passed", "reference": "38 strict items" },
    { "id": "scope-review", "type": "review", "subject": "changed scope, security, recovery, portability, attribution, and bootstrap boundary", "result": "passed", "reference": "same-session read-only review" }
  ],
  "assumptions": [],
  "openQuestions": [],
  "nextAction": { "kind": "continue", "description": "Deliver only the exact implementation, Sync, Archive, cleanup, and runtime-only activation lifecycle." },
  "details": {
    "assurance": "local-review",
    "worker": { "executionIdentity": "same-session-terminal-controller-inventory-review", "sameSession": true, "readOnly": true, "canMutate": false, "canApprove": false },
    "reviewedScope": {
      "targets": [
        "scripts/sdd/autonomous-sdd-admission.mjs",
        "scripts/sdd/autonomous-sdd-legacy.mjs",
        "scripts/sdd/test/autonomous-sdd-admission.test.mjs",
        "scripts/runtime/test/launcher.test.mjs",
        "openspec/changes/repair-v2-initializer-terminal-controller-inventory"
      ],
      "contextPaths": [
        "openspec/specs/autonomous-sdd-run-contract/spec.md",
        "openspec/specs/autonomous-sdd-continuation/spec.md",
        "scripts/sdd/autonomous-sdd-controller.mjs",
        "scripts/sdd/autonomous-sdd-local-store.mjs"
      ],
      "evidenceIds": ["focused", "installed-wrapper", "full-node", "strict-openspec", "scope-review"]
    },
    "findings": [],
    "coverage": [
      { "area": "controller/archive identity, containment, validation, and fail-closed behavior", "status": "reviewed", "evidenceIds": ["focused", "scope-review"] },
      { "area": "installed wrapper, Git-common topology, retry, and byte preservation", "status": "reviewed", "evidenceIds": ["installed-wrapper", "full-node"] },
      { "area": "OpenSpec, tracking, security, recovery, portability, attribution, and unrelated scope", "status": "reviewed", "evidenceIds": ["strict-openspec", "scope-review"] },
      { "area": "web UI and accessibility", "status": "not-applicable", "evidenceIds": [] }
    ],
    "standardsSelection": { "selectedRuleIds": [], "scopedOverrides": [], "notApplicableRuleIds": [] },
    "evidenceGaps": [],
    "scopeSummary": "Only prior schema-5 controllers with an exact deterministic identity and one matching immutable local v2 archive are compatible; every pending, active, malformed, duplicated, symlinked, or conflicting record remains ambiguous before claim creation."
  }
}
