{
  "schemaVersion": 1,
  "skill": "base-code-review",
  "status": "completed",
  "mode": "autonomous",
  "summary": "Fresh bounded same-session local review found no remaining findings after the direct-admission exclusion boundary, Windows directory-fsync, and portable checkpoint-format defects were corrected.",
  "artifacts": [
    { "kind": "file", "operation": "read", "subject": "scripts/sdd/autonomous-sdd-legacy.mjs" },
    { "kind": "file", "operation": "read", "subject": "scripts/sdd/autonomous-sdd-admission.mjs" },
    { "kind": "file", "operation": "read", "subject": "scripts/sdd/autonomous-sdd-controller.mjs" },
    { "kind": "file", "operation": "read", "subject": "scripts/runtime/bin/autonomous-sdd-controller.mjs" },
    { "kind": "file", "operation": "read", "subject": "scripts/sdd/test/autonomous-sdd-admission.test.mjs" },
    { "kind": "file", "operation": "read", "subject": "scripts/runtime/test/launcher.test.mjs" },
    { "kind": "file", "operation": "read", "subject": "docs/autonomous-sdd-lifecycle.md" },
    { "kind": "file", "operation": "read", "subject": "ai-planning/handoff-docs/autonomous-sdd-blocker-register-and-plain-english-handoff.md" }
  ],
  "evidence": [
    { "id": "focused-admission", "type": "test", "subject": "legacy inventory and v2 initializer behavior", "result": "passed", "reference": "15 focused Node tests after final correction" },
    { "id": "staged-runtime", "type": "test", "subject": "built runtime launcher against real Git-common state", "result": "passed", "reference": "installed-wrapper critical-flow test after final correction" },
    { "id": "full-node", "type": "test", "subject": "all repository Node suites", "result": "passed", "reference": "367 local Node tests after final correction" },
    { "id": "strict-openspec", "type": "validation", "subject": "all OpenSpec specs and active changes", "result": "passed", "reference": "39 strict validation items" },
    { "id": "scope-security", "type": "review", "subject": "complete changed scope, caller boundary, path containment, recovery, secrets, portability, and attribution", "result": "passed", "reference": "fresh same-session read-only review after all local corrections; exact-head Windows rerun remains a delivery gate" }
  ],
  "assumptions": [],
  "openQuestions": [],
  "nextAction": { "kind": "continue", "description": "Record formal OpenSpec Verify evidence and continue only the exact pre-v2 implementation, Sync, Archive, cleanup, and runtime-installation lifecycle." },
  "details": {
    "assurance": "local-review",
    "worker": { "executionIdentity": "same-session-initializer-inventory-final-review", "sameSession": true, "readOnly": true, "canMutate": false, "canApprove": false },
    "reviewedScope": {
      "targets": [
        "ai-planning/handoff-docs/autonomous-sdd-blocker-register-and-plain-english-handoff.md",
        "docs/autonomous-sdd-lifecycle.md",
        "openspec/changes/repair-v2-initializer-self-inventory",
        "scripts/runtime/bin/autonomous-sdd-controller.mjs",
        "scripts/runtime/test/launcher.test.mjs",
        "scripts/sdd/autonomous-sdd-admission.mjs",
        "scripts/sdd/autonomous-sdd-controller.mjs",
        "scripts/sdd/autonomous-sdd-legacy.mjs",
        "scripts/sdd/test/autonomous-sdd-admission.test.mjs"
      ],
      "contextPaths": [
        "openspec/changes/repair-v2-initializer-self-inventory/proposal.md",
        "openspec/changes/repair-v2-initializer-self-inventory/design.md",
        "openspec/changes/repair-v2-initializer-self-inventory/tasks.md",
        "openspec/changes/repair-v2-initializer-self-inventory/specs/autonomous-sdd-continuation/spec.md",
        "openspec/changes/repair-v2-initializer-self-inventory/specs/autonomous-sdd-run-contract/spec.md",
        "openspec/changes/repair-v2-initializer-self-inventory/tracking.yaml"
      ],
      "evidenceIds": ["focused-admission", "staged-runtime", "full-node", "strict-openspec", "scope-security"]
    },
    "findings": [],
    "coverage": [
      { "area": "legacy candidate typing and immutable fail-closed classification", "status": "reviewed", "evidenceIds": ["focused-admission", "scope-security"] },
      { "area": "initializer-only exact exclusion and direct caller non-bypass", "status": "reviewed", "evidenceIds": ["focused-admission", "staged-runtime", "scope-security"] },
      { "area": "Git-common portability, deterministic identity, interruption, retry, and no-claim failure", "status": "reviewed", "evidenceIds": ["staged-runtime", "full-node"] },
      { "area": "OpenSpec, tracking, docs, secrets, dependencies, attribution, and unrelated scope", "status": "reviewed", "evidenceIds": ["strict-openspec", "scope-security"] },
      { "area": "web user interface and accessibility", "status": "not-applicable", "evidenceIds": [] }
    ],
    "standardsSelection": { "selectedRuleIds": [], "scopedOverrides": [], "notApplicableRuleIds": [] },
    "evidenceGaps": [],
    "scopeSummary": "Reviewed only the exact initializer self-inventory repair and every changed root. Raw admission cannot honor caller exclusions; initializer admission can exclude only its byte-matching persisted schema-5 checkpoint with matching authorization, repository, provider, and admission identities; every other genuine controller remains immutable and fail-closed. Checkpoint persistence retains file fsync and atomic rename on all hosts, POSIX directory fsync, and the validated provider durability boundary where Node cannot open directories on Windows. Durable checkpoint references use POSIX separators while filesystem resolution remains platform native."
  }
}
