{
  "schemaVersion": 1,
  "skill": "base-code-review",
  "status": "completed",
  "mode": "autonomous",
  "summary": "Bounded same-session local review found no remaining objective findings in the v2 terminalization repair at the reviewed repair-branch head.",
  "artifacts": [
    { "kind": "file", "operation": "read", "subject": "scripts/sdd/autonomous-sdd-controller.mjs" },
    { "kind": "file", "operation": "read", "subject": "scripts/sdd/autonomous-sdd-run-contract.mjs" },
    { "kind": "file", "operation": "read", "subject": "scripts/runtime/bin/autonomous-sdd-controller.mjs" },
    { "kind": "file", "operation": "read", "subject": "scripts/runtime/manifest.json" },
    { "kind": "file", "operation": "read", "subject": "docs/autonomous-sdd-lifecycle.md" }
  ],
  "evidence": [
    { "id": "focused-suite", "type": "test", "subject": "terminalization controller, admission, run-contract, and runtime suites", "result": "passed", "reference": "100 local Node tests at reviewed head" },
    { "id": "full-local-suite", "type": "test", "subject": "repository Node test suites", "result": "passed", "reference": "356 local Node tests at reviewed head" },
    { "id": "openspec-strict", "type": "validation", "subject": "all OpenSpec specs and active change", "result": "passed", "reference": "36 strict validation items at reviewed head" },
    { "id": "tracking-validation", "type": "validation", "subject": "repair change tracking metadata", "result": "passed", "reference": "tracking validator at reviewed head" },
    { "id": "review-source", "type": "review", "subject": "bounded repair code, runtime dispatch, specifications, documentation, and tests", "result": "passed", "reference": "same-session local review after freshness and archive-identity corrections" }
  ],
  "assumptions": [],
  "openQuestions": [],
  "nextAction": { "kind": "continue", "description": "Proceed to OpenSpec Verify and the authorized repair delivery lifecycle." },
  "details": {
    "assurance": "local-review",
    "worker": { "executionIdentity": "same-session-local-review-worker", "sameSession": true, "readOnly": true, "canMutate": false, "canApprove": false },
    "reviewedScope": {
      "targets": ["scripts/sdd/autonomous-sdd-controller.mjs", "scripts/sdd/autonomous-sdd-run-contract.mjs", "scripts/runtime/bin/autonomous-sdd-controller.mjs", "scripts/runtime/manifest.json", "docs/autonomous-sdd-lifecycle.md", "scripts/sdd/test/autonomous-sdd-controller.test.mjs", "scripts/sdd/test/autonomous-sdd-admission.test.mjs", "scripts/sdd/test/autonomous-sdd-run-contract.test.mjs"],
      "contextPaths": ["openspec/changes/repair-m1-s2-v2-terminalization/proposal.md", "openspec/changes/repair-m1-s2-v2-terminalization/design.md", "openspec/changes/repair-m1-s2-v2-terminalization/tasks.md", "openspec/changes/repair-m1-s2-v2-terminalization/specs/autonomous-sdd-v2-terminalization/spec.md", "openspec/changes/repair-m1-s2-v2-terminalization/specs/autonomous-sdd-run-contract/spec.md", "openspec/changes/repair-m1-s2-v2-terminalization/specs/shared-sdd-runtime-distribution/spec.md"],
      "evidenceIds": ["focused-suite", "full-local-suite", "openspec-strict", "tracking-validation", "review-source"]
    },
    "findings": [],
    "coverage": [
      { "area": "requirements and terminalization behavior", "status": "reviewed", "evidenceIds": ["review-source", "openspec-strict"] },
      { "area": "input validation, state integrity, and recovery", "status": "reviewed", "evidenceIds": ["review-source", "focused-suite"] },
      { "area": "runtime dispatch, tests, and regressions", "status": "reviewed", "evidenceIds": ["focused-suite", "full-local-suite"] },
      { "area": "authorization, portability, and sensitive data", "status": "reviewed", "evidenceIds": ["review-source"] },
      { "area": "web accessibility", "status": "not-applicable", "evidenceIds": [] }
    ],
    "standardsSelection": { "selectedRuleIds": [], "scopedOverrides": [], "notApplicableRuleIds": [] },
    "evidenceGaps": [],
    "scopeSummary": "Reviewed the exact v2 terminalization repair only. The review confirmed that the controller derives its state location, checks all run identities, requires fresh completed lifecycle proof, preserves immutable audit records, dispatches only through the declared runtime, and leaves another active claim blocking admission."
  }
}
