{
  "schemaVersion": 1,
  "skill": "base-verification-loop",
  "status": "completed",
  "mode": "autonomous",
  "summary": "Production evidence is ready for OpenSpec Verify.",
  "artifacts": [{ "kind": "file", "operation": "updated", "subject": "src/widget.mjs" }],
  "evidence": [
    { "id": "focused", "type": "test", "subject": "focused tests", "result": "passed" },
    { "id": "critical", "type": "test", "subject": "critical flow", "result": "passed" },
    { "id": "regression", "type": "test", "subject": "regression suite", "result": "passed" },
    { "id": "repeatability", "type": "test", "subject": "repeat run", "result": "passed" },
    { "id": "operational", "type": "validation", "subject": "operational checks", "result": "passed" },
    { "id": "release", "type": "validation", "subject": "release evidence", "result": "passed" },
    { "id": "local-review", "type": "review", "subject": "changed implementation paths", "result": "passed" },
    { "id": "ci-current", "type": "validation", "subject": "exact-head CI", "result": "passed" },
    { "id": "strict-review", "type": "review", "subject": "strict isolated independent review", "result": "passed" }
  ],
  "assumptions": [],
  "openQuestions": [],
  "nextAction": { "kind": "continue", "description": "Run formal OpenSpec Verify." },
  "details": {
    "profile": "production-rapid",
    "uiScope": { "kind": "none", "layoutChanged": false, "materiallyChanged": false },
    "intendedBehavior": "The widget returns a stable normalized value under production checks.",
    "criticalPath": "Invoke the widget through the production entry point.",
    "changedPaths": ["src/widget.mjs"],
    "selectedChecks": [
      { "id": "focused-unit-or-integration", "category": "focused", "required": true, "result": "passed", "evidenceId": "focused" },
      { "id": "critical-flow", "category": "critical-flow", "required": true, "result": "passed", "evidenceId": "critical" },
      { "id": "regression-coverage", "category": "regression", "required": true, "result": "passed", "evidenceId": "regression" },
      { "id": "repeatability", "category": "repeatability", "required": true, "result": "passed", "evidenceId": "repeatability" },
      { "id": "operational-checks", "category": "operational", "required": true, "result": "passed", "evidenceId": "operational" },
      { "id": "release-evidence", "category": "release", "required": true, "result": "passed", "evidenceId": "release" },
      { "id": "local-review", "category": "review", "required": true, "result": "passed", "evidenceId": "local-review" },
      { "id": "exact-head-ci", "category": "ci", "required": true, "result": "passed", "evidenceId": "ci-current" },
      { "id": "strict-independent-review", "category": "independent-review", "required": true, "result": "passed", "evidenceId": "strict-review" }
    ],
    "evidenceBindings": [
      { "evidenceId": "focused", "binding": { "kind": "commit", "value": "1111111111111111111111111111111111111111" }, "changedPaths": ["src/widget.mjs"] },
      { "evidenceId": "critical", "binding": { "kind": "commit", "value": "1111111111111111111111111111111111111111" }, "changedPaths": ["src/widget.mjs"] },
      { "evidenceId": "regression", "binding": { "kind": "commit", "value": "1111111111111111111111111111111111111111" }, "changedPaths": ["src/widget.mjs"] },
      { "evidenceId": "repeatability", "binding": { "kind": "commit", "value": "1111111111111111111111111111111111111111" }, "changedPaths": ["src/widget.mjs"] },
      { "evidenceId": "operational", "binding": { "kind": "commit", "value": "1111111111111111111111111111111111111111" }, "changedPaths": ["src/widget.mjs"] },
      { "evidenceId": "release", "binding": { "kind": "commit", "value": "1111111111111111111111111111111111111111" }, "changedPaths": ["src/widget.mjs"] },
      { "evidenceId": "local-review", "binding": { "kind": "commit", "value": "1111111111111111111111111111111111111111" }, "changedPaths": ["src/widget.mjs"] },
      { "evidenceId": "ci-current", "binding": { "kind": "commit", "value": "1111111111111111111111111111111111111111" }, "changedPaths": ["src/widget.mjs"] },
      { "evidenceId": "strict-review", "binding": { "kind": "commit", "value": "1111111111111111111111111111111111111111" }, "changedPaths": ["src/widget.mjs"] }
    ],
    "correctionBudget": 3,
    "correctionAttempts": [],
    "reviewedPaths": ["src/widget.mjs"],
    "localReviewFindings": [],
    "unresolvedGaps": [],
    "recoverySteps": ["Rebuild exact-head evidence when the commit changes."],
    "binding": { "kind": "commit", "value": "1111111111111111111111111111111111111111" },
    "readiness": "ready-for-openspec-verify",
    "productionGate": {
      "head": "1111111111111111111111111111111111111111",
      "ciEvidenceId": "ci-current",
      "independentReviewEvidenceId": "strict-review",
      "reviewStatus": "passed",
      "reviewHead": "1111111111111111111111111111111111111111",
      "reviewerSession": "reviewer-session-1",
      "implementerSession": "implementer-session-1",
      "source": "isolated-independent-review",
      "assurance": "strict-isolated"
    }
  }
}
